5283,KNS Restaurant,5,"The menu here is intimidating because it contains Indian, Thai, Indonesian, and Chinese options. However, this being a halal restaurant with all the cooks appearing Indian, Pakistani, Sri Lankan, or Bangladeshi, I chose the Indian dishes. I enjoyed my food and drinks and hope to re-visit. (August 2022)",2022-08-15T12:29:17.912Z,0,Matthew Rafat,284.0,False,,,a year ago,,,,,,,,,ChZDSUhNMG9nS0VJQ0FnSUR1clBiVkl3EAE,,,,,,,,,,,,,,,,,,,,,,,,,,,,,,,,,,,,Google,https://www.google.com/maps/reviews/data=!4m8!14m7!1m6!2m5!1sChZDSUhNMG9nS0VJQ0FnSUR1clBiVkl3EAE!2m1!1s0x0:0xf6e32a820118352a!3m1!1s2@1:CIHM0ogKEICAgIDurPbVIw%7CCgwInfjolwYQgO-hswM%7C?hl=en,110075529991238476319,https://lh3.googleusercontent.com/a-/ALV-UjUM0Ha5Z6GtK6T2SwAhWzzS6rX3OWKNxq58Vjr_izNKsg=s120-c-rp-mo-ba6-br100,https://www.google.com/maps/contrib/110075529991238476319?hl=en,,,,,,,,,,,,,,,,,,en,48
4428,Chang Korean Charcoal BBQ Restaurant,4,We celebrated my niece birthday and as we had quite a few people we were given a room which provides the privacy. Service was attentive and the bbq was done before they serve.  So we do not leave the place smelling like bbq. Plus a huge variety of banchan. Abit pricey and might not be for everyday. But for special occasions it is a good choice for korean bbq,2023-09-18T00:09:51.763Z,0,Audrey Tan,25.0,True,,,5 months ago,,Dinner,,$100+,Dine in,4.0,4.0,4.0,ChZDSUhNMG9nS0VJQ0FnSUNaaTRDZlNREAE,https://lh5.googleusercontent.com/p/AF1QipNnfw58hHninK0ZyUy5HQAyr585IW0eulp6i1Nz=w150-h150-k-no-p,https://lh5.googleusercontent.com/p/AF1QipMwEqFATvHkoP2Fz__1XiTbwpowejUd-vfVjJFg=w150-h150-k-no-p,https://lh5.googleusercontent.com/p/AF1QipPIjonwXPlZNgzi6B9XhxS92PGA8D_eDncG5qZY=w150-h150-k-no-p,https://lh5.googleusercontent.com/p/AF1QipMsggaTItk0Go5JIm2rbOWe7-rWKN9hcLEfYCT4=w150-h150-k-no-p,https://lh5.googleusercontent.com/p/AF1QipPJQVmQDjFaBcJKl8RPQrzSGQIrAq1eLHwbg7mo=w150-h150-k-no-p,https://lh5.googleusercontent.com/p/AF1QipOb8WSgwL_Np73UADiYkpk2kP4MMJNsJGz8POfX=w150-h150-k-no-p,https://lh5.googleusercontent.com/p/AF1QipMLKpoJZVPckzAVw9AFw8wltTXQOenM10AN-kN3=w150-h150-k-no-p,https://lh5.googleusercontent.com/p/AF1QipNGnpNTBjLPSrweP_OvOJpJGz9y8BTGZkhKsrXN=w150-h150-k-no-p,https://lh5.googleusercontent.com/p/AF1QipNOd-fnVwvHJ0w8L77IG6gPOLey5UcvJIDuwkPL=w150-h150-k-no-p,https://lh5.googleusercontent.com/p/AF1QipPrFpej-lu7XQcwz8lMt_mt2vuMq-N_sEu9j0hJ=w150-h150-k-no-p,https://lh5.googleusercontent.com/p/AF1QipNTUCSdEKhLZH1ilraW4vihGrDoC3t-H06m2ZI_=w150-h150-k-no-p,https://lh5.googleusercontent.com/p/AF1QipMqh_Ji21oFZbEMDGij2-ZVNsUmKsYPZ4b2WsWg=w150-h150-k-no-p,https://lh5.googleusercontent.com/p/AF1QipMbg7abLC0H0Ntk2LCw9Wyi0aWu0CortiiX0FZs=w150-h150-k-no-p,,,,,,,,,,,,,,,,,,,,,,,Google,https://www.google.com/maps/reviews/data=!4m8!14m7!1m6!2m5!1sChZDSUhNMG9nS0VJQ0FnSUNaaTRDZlNREAE!2m1!1s0x0:0xcb4cfe8f663d40c4!3m1!1s2@1:CIHM0ogKEICAgICZi4CfSQ%7CCgwIz6qeqAYQ-PTt6wI%7C?hl=en,108612145467416863443,https://lh3.googleusercontent.com/a-/ALV-UjVV9bte1uFB249HPJT6F4BuWyVIMXoOeoE-mliM6BzNskoF=s120-c-rp-mo-ba3-br100,https://www.google.com/maps/contrib/108612145467416863443?hl=en,,,,,,,,,,,,,,,,,,en,69
1657,SomBoon Thai restaurant,5,"Very nice and breezy kampong vibe. Their menu was quite lengthy cuz they have pictures attached next to each dish (which was a very nice thing, btw!)
The coconut water was SO SWEET and my mum loved the steamed chicken so much.
Price wise it’s definitely on the higher end, but they do have a student discount. :)
Would recommend coming here at night for the vibes✨",2023-12-02T12:39:43.621Z,0,Aashmika Varma,143.0,False,,,3 months ago,,Dinner,,$10–20,Dine in,5.0,5.0,5.0,ChZDSUhNMG9nS0VJQ0FnSURsc2QzVUpBEAE,https://lh5.googleusercontent.com/p/AF1QipNdxO1l5kDR0ggcd2cYbPiqiw5c2wt4mJyHNPC6=w150-h150-k-no-p,https://lh5.googleusercontent.com/p/AF1QipMEgYoEkn-dqeqP96zbGOWI4IHVyh3EK7w2Shxv=w150-h150-k-no-p,https://lh5.googleusercontent.com/p/AF1QipPoHexgNnCgKvAIpz76Ct89N4ohyE8682Z4MzSr=w150-h150-k-no-p,https://lh5.googleusercontent.com/p/AF1QipN5Yp6uBZbp3DJXcv5S8twFW9msg4rrPB7VCwhk=w150-h150-k-no-p,https://lh5.googleusercontent.com/p/AF1QipMAk4a9CQJm_Eq-ufhLxRP9al-FFY5s5EsrdXMl=w150-h150-k-no-p,https://lh5.googleusercontent.com/p/AF1QipPgMtlkoFG2EsRPPS19FudVHC8Csc-sKKBQuuga=w150-h150-k-no-p,https://lh5.googleusercontent.com/p/AF1QipPSqDbTyyz1KdSiny7yms_DhplVDpu1bjn6SlMg=w150-h150-k-no-p,https://lh5.googleusercontent.com/p/AF1QipOWReO80ZD0Q6j3nG4XPBikOIg4VHLb8TQal-qx=w150-h150-k-no-p,https://lh5.googleusercontent.com/p/AF1QipPlETBA31dQq_lQQ_lfVWQKv673okcnDDgAWVTT=w150-h150-k-no-p,https://lh5.googleusercontent.com/p/AF1QipOZhaGaHt9ZykbYd4eImqi4GKFraSJdSZF4mSWD=w150-h150-k-no-p,https://lh5.googleusercontent.com/p/AF1QipP6M6TxU7LnGswPwWlPLQgHyoC1v1znmvfvrM_j=w150-h150-k-no-p,https://lh5.googleusercontent.com/p/AF1QipPpqbVHS6WRu1laN8EG5CUQ-W9E1KubDRmjlHNn=w150-h150-k-no-p,https://lh5.googleusercontent.com/p/AF1QipNFw8ZxcNA2lYRcw8X8YgtG7HBulIwjRItS4i5A=w150-h150-k-no-p,,,,,,,,,,,,,,,,,,,,,,,Google,https://www.google.com/maps/reviews/data=!4m8!14m7!1m6!2m5!1sChZDSUhNMG9nS0VJQ0FnSURsc2QzVUpBEAE!2m1!1s0x0:0x48885017fb611a86!3m1!1s2@1:CIHM0ogKEICAgIDlsd3UJA%7CCgwIj8usqwYQ6N-pqAI%7C?hl=en,104152931382854540911,https://lh3.googleusercontent.com/a/ACg8ocJBCh7c8hIrflz4b76o3UtuUayggfhWt2ImTKd_RnO5IbA=s120-c-rp-mo-ba5-br100,https://www.google.com/maps/contrib/104152931382854540911?hl=en,,,,,,,,,,,,,,,,,,en,67
4781,Buey Tahan See-Food Restaurant @ DTE,2,Been patronising here since open. It was good when it 1st open with service and food quality at expected level. Today was real disappointment as the sambal stingray wasn't BBQ enuf and totally not authentic. The sambal was sweet and not spicy at the least! The claypot tofu has only 6 pc of small tofu and can tell its ore cooked then pour in claypot. I am expecting claypot sizzle. I am always a fan since your opening but today i paid 33 bucks & left unhappy,2023-02-16T10:48:33.975Z,0,Driftmasters Jason,33.0,True,2023-02-17T12:00:33.097Z,,a year ago,,Dinner,,,Dine in,,,,ChZDSUhNMG9nS0VJQ0FnSUNocWZLNlZBEAE,https://lh5.googleusercontent.com/p/AF1QipPSaoxyFPOWTnipz8u_drtNoCrPx30SLIDO-Q5c=w150-h150-k-no-p,https://lh5.googleusercontent.com/p/AF1QipOziSCzGF0WnKW36YTkxIwVABXOcvbRv9kCZMd5=w150-h150-k-no-p,,,,,,,,,,,,,,,,,,,,,,,,,,,,,,,,,,Google,https://www.google.com/maps/reviews/data=!4m8!14m7!1m6!2m5!1sChZDSUhNMG9nS0VJQ0FnSUNocWZLNlZBEAE!2m1!1s0x0:0x91e5b8945dbe1839!3m1!1s2@1:CIHM0ogKEICAgIChqfK6VA%7CCgwIgZS4nwYQ8IT60AM%7C?hl=en,109370100867441560714,https://lh3.googleusercontent.com/a-/ALV-UjVMo-VJkF1rtbZPGI1UTYCG14ngcQphACmBsJcGpLZB6BY=s120-c-rp-mo-ba3-br100,https://www.google.com/maps/contrib/109370100867441560714?hl=en,,,,,,,,,,,,,,,,,,en,87
2911,Zén,4,"Zen Restaurant in Singapore, nestled within a Michelin-starred hotel, is a culinary sanctuary where artistry meets gastronomy. The dining experience transcends mere sustenance, immersing patrons in a symphony of flavors meticulously crafted by master chefs.

From the moment one enters, the ambiance is a harmonious blend of tranquility and sophistication. The minimalist decor, adorned with subtle Asian influences, sets the stage for a dining journey that transcends the ordinary.

The menu is a testament to the chef's dedication to perfection. Each dish is a canvas, showcasing the finest ingredients and innovative techniques. The sushi, a delicate dance of textures and tastes, highlights the restaurant's commitment to authenticity. The sashimi, served with precision, melts in the mouth, a testament to the freshness of the seafood.

The culinary artistry extends to the hot kitchen, where traditional Asian flavors are reimagined with a contemporary flair. Signature dishes, such as the miso-glazed black cod, exemplify the chef's mastery in balancing flavors, leaving a lasting impression on discerning palates.

Service at Zen is an impeccable ballet, with attentive staff anticipating every need without intruding on the dining experience. The wine list is curated to complement the diverse flavors, elevating the meal to a sensory journey.

In conclusion, Zen Restaurant in Singapore not only lives up to its Michelin-starred status but transcends expectations. It is a haven for connoisseurs seeking a symphony of flavors orchestrated with precision and passion, making it a jewel in the culinary crown of the Lion City.",2023-11-25T02:32:33.888Z,1,ajleeblog,279.0,True,,,3 months ago,,,,,,4.0,4.0,4.0,ChZDSUhNMG9nS0VJQ0FnSUNsM2R2UVFBEAE,https://lh5.googleusercontent.com/p/AF1QipPUIFR4wC3sdzruemecOBgH4pHXy0hONJWJURO5=w150-h150-k-no-p,https://lh5.googleusercontent.com/p/AF1QipNe_eU5R5EvN9CxGB2b46D9bUKu5bNB1C51Tp1T=w150-h150-k-no-p,https://lh5.googleusercontent.com/p/AF1QipMHkIV9cEyIjrdxl1zhbMEQqR6qzWyR3SsnaUCK=w150-h150-k-no-p,https://lh5.googleusercontent.com/p/AF1QipMmBtjcXvQEkJcJQjxtlZ0fvNOVAE4dRjt6IrA1=w150-h150-k-no-p,https://lh5.googleusercontent.com/p/AF1QipN9ipf29H8334jkrq-ResN0zimvP9XBlyXzYIK-=w150-h150-k-no-p,https://lh5.googleusercontent.com/p/AF1QipOVGSXcwBvrn7lLVaVZb9aqvp5rDCvJq0m02QFZ=w150-h150-k-no-p,https://lh5.googleusercontent.com/p/AF1QipMbRXNLJq2dbLcV9_MSMNdp6KMObRi-_epr3K-Y=w150-h150-k-no-p,https://lh5.googleusercontent.com/p/AF1QipOTL7DDMTuBVsKxpFwrUjhOVNrlC2TNSOoZ7W4D=w150-h150-k-no-p,https://lh5.googleusercontent.com/p/AF1QipNagyyTNk0gHNPChn7-pZ4FKEpv1uyS1b7KbDh5=w150-h150-k-no-p,https://lh5.googleusercontent.com/p/AF1QipNlOixrQj0GnfFi_5x0QnnBTdP6ouYntop4BOFr=w150-h150-k-no-p,https://lh5.googleusercontent.com/p/AF1QipMtBJIqozKzmCsvm6nf2_uADON3-rzPGr876x9M=w150-h150-k-no-p,https://lh5.googleusercontent.com/p/AF1QipNDQKCG_ty8eqaqD-vLXCs8Dr96eqDVSQAJLgq_=w150-h150-k-no-p,https://lh5.googleusercontent.com/p/AF1QipPnuFD4_ODOnUNUFB8AWai24E1Q6IGyrlMS6cug=w150-h150-k-no-p,https://lh5.googleusercontent.com/p/AF1QipOaPrVWxqwhWS1gxg3nLlTQFljXK16OJmZ1JVYa=w150-h150-k-no-p,https://lh5.googleusercontent.com/p/AF1QipODH6JvXe7e05c8IqdZguO_y7BtHroPQxWggo3O=w150-h150-k-no-p,https://lh5.googleusercontent.com/p/AF1QipPGihc02LMCSrz2LYL40bCU9GwT2c3HzSgScCgl=w150-h150-k-no-p,https://lh5.googleusercontent.com/p/AF1QipNaBM7Rx_uIGQjAk6R75fKVpmFv_NZCwFulcX5Y=w150-h150-k-no-p,https://lh5.googleusercontent.com/p/AF1QipPsZidsUqTrBduJyIEz68_V-EnJjBn6GaZKYDTI=w150-h150-k-no-p,https://lh5.googleusercontent.com/p/AF1QipMSaBy4Pg5hSdNdYXRrOCr0GSopoW5U4X8HDYoz=w150-h150-k-no-p,https://lh5.googleusercontent.com/p/AF1QipPbwjpwxDRD0rGouGcCK2_AOiWRS0rNNssTQcHO=w150-h150-k-no-p,https://lh5.googleusercontent.com/p/AF1QipMTmK3b_uuHpCo-WI6i6eq9oLWbTjoGiPOgFcxk=w150-h150-k-no-p,https://lh5.googleusercontent.com/p/AF1QipNw5COEaT6isqla20q3hA616NQqxZe6tILLANbr=w150-h150-k-no-p,https://lh5.googleusercontent.com/p/AF1QipMLugI48gWWULA_mPTniTf-MO7D1NAltiFC5uM_=w150-h150-k-no-p,https://lh5.googleusercontent.com/p/AF1QipOVNUlELIlUWQf_mxSqfjMFIkZNLQh7cOoxfXaI=w150-h150-k-no-p,https://lh5.googleusercontent.com/p/AF1QipMA6eAa3evRQyK2BsYYOztU0xSA_LIMvoTcZs_p=w150-h150-k-no-p,https://lh5.googleusercontent.com/p/AF1QipPrabqE9G9lbeFKHE_aAQBvP_sLfhCEQmasyVxV=w150-h150-k-no-p,https://lh5.googleusercontent.com/p/AF1QipNIJv_1VWVY2WOFYHOkU7meNdE7qtDov7PCRZkn=w150-h150-k-no-p,https://lh5.googleusercontent.com/p/AF1QipMZoEPkia6jdIVz-3qhXygdY_wcVi-D58MHsBFg=w150-h150-k-no-p,https://lh5.googleusercontent.com/p/AF1QipOUZKK0GJNPRYqf08VBXeFWOxqCmg0kdEt8Ukig=w150-h150-k-no-p,,,,,,,Google,https://www.google.com/maps/reviews/data=!4m8!14m7!1m6!2m5!1sChZDSUhNMG9nS0VJQ0FnSUNsM2R2UVFBEAE!2m1!1s0x0:0xcaf133f88dc80cee!3m1!1s2@1:CIHM0ogKEICAgICl3dvQQA%7CCgwIwbmFqwYQuKG9pwM%7C?hl=en,101431495761220231120,https://lh3.googleusercontent.com/a-/ALV-UjXd6ehwty-fRZmF05mXQvxRsteU0TkTRFGNkTCcNMbSW74S=s120-c-rp-mo-ba7-br100,https://www.google.com/maps/contrib/101431495761220231120?hl=en,,,,,,,,,,,,,,,,,,en,245
10022,Lai Huat Signatures,1,"Ordered prawn paste chicken, onion omelette, and HK kailan. The dishes were done quickly and we appreciate the speedy service.
There was pork floss sprinkled over the kailan which was unusual for us, as it made the dish too sweet. The prawn paste chicken lacked flavour, tasting like it was fried in reused oil. Maybe we caught them on a bad day as the other reviews seem pretty decent.
The eatery was small but there is plenty of large tables available.",2024-01-09T13:21:59.679Z,0,Angela Chong,101.0,False,,,a month ago,,Dinner,,$30–40,Take out,2.0,1.0,3.0,ChdDSUhNMG9nS0VJQ0FnSUQxM2NYUS1BRRAB,,,,,,,,,,,,,,,,,,,,,,,,,,,,,,,,,,,,Google,https://www.google.com/maps/reviews/data=!4m8!14m7!1m6!2m5!1sChdDSUhNMG9nS0VJQ0FnSUQxM2NYUS1BRRAB!2m1!1s0x0:0x90d8e4d4cf9846df!3m1!1s2@1:CIHM0ogKEICAgID13cXQ-AE%7CCgwI95D1rAYQ4KWFxAI%7C?hl=en,106182215167408819125,https://lh3.googleusercontent.com/a/ACg8ocJN6Ka7eD1-bt0Wl3a9vlBR304aC0ToD2hJOGLrlsEP=s120-c-rp-mo-ba4-br100,https://www.google.com/maps/contrib/106182215167408819125?hl=en,,,,,,,,,,,,,,,,,,en,81
5589,Pixy Restaurant & Bar,5,"Good quality of food. It was delicious. We had the iberico pork, dessert, squid, tuna, risotto. They were all delicious. Ambience is great too. The Chef even customised a “Happy Birthday” wordings onto my dessert as it was my birthday. Great service.
Definitely highly recommended.",2022-09-07T15:05:01.839Z,0,Adeline Yong,5.0,False,,,a year ago,,Dinner,,,Dine in,,,,ChZDSUhNMG9nS0VJQ0FnSUNlOUtlY2VBEAE,https://lh5.googleusercontent.com/p/AF1QipNuT9FR_TLCsx3Zs-uueYp9MJYornQlXM0_MSBu=w150-h150-k-no-p,https://lh5.googleusercontent.com/p/AF1QipNO0QSe6kC-pPPLC32j0BxlUiozlSWeox17tB0q=w150-h150-k-no-p,https://lh5.googleusercontent.com/p/AF1QipPCkIXq5P0oNs2RiJjaUM4dMbps6NWxbuSyuRAf=w150-h150-k-no-p,https://lh5.googleusercontent.com/p/AF1QipP6CYLqzxIMMcWMOZyt-qryOEB6yDzKysbUmduH=w150-h150-k-no-p,https://lh5.googleusercontent.com/p/AF1QipPQ7BUL5vkXKugpe8bhIUeBzdvqDZrhLHyMkPhw=w150-h150-k-no-p,,,,,,,,,,,,,,,,,,,,,,,,,,,,,,,Google,https://www.google.com/maps/reviews/data=!4m8!14m7!1m6!2m5!1sChZDSUhNMG9nS0VJQ0FnSUNlOUtlY2VBEAE!2m1!1s0x0:0xf227f44f0e381968!3m1!1s2@1:CIHM0ogKEICAgICe9KeceA%7CCgwInebimAYQuLWokAM%7C?hl=en,100067634761838644537,https://lh3.googleusercontent.com/a/ACg8ocJnaOtkWmOpShL4062LXu6uksu51uBb9nFjVNGUOpej=s120-c-rp-mo-br100,https://www.google.com/maps/contrib/100067634761838644537?hl=en,,,,,,,,,,,,,,,,,,en,45
812,Douraku Sushi,5,Two of us had lunch here. It actually inside the Tunglok Seafood Restaurant. The food served was fresh and nice especially Sashimi. The service staff was also attentive and helpful. Great experience! Will visit again!,2021-10-12T09:51:55.681Z,1,Phang Chooi Lin,9.0,False,,,2 years ago,,,,,,,,,ChdDSUhNMG9nS0VJQ0FnSUQ2MjdLdzdRRRAB,,,,,,,,,,,,,,,,,,,,,,,,,,,,,,,,,,,,Google,https://www.google.com/maps/reviews/data=!4m8!14m7!1m6!2m5!1sChdDSUhNMG9nS0VJQ0FnSUQ2MjdLdzdRRRAB!2m1!1s0x0:0x7af2533b3b844093!3m1!1s2@1:CIHM0ogKEICAgID627Kw7QE%7CCgwIu7WViwYQgLyFxQI%7C?hl=en,106621565360662674570,https://lh3.googleusercontent.com/a-/ALV-UjVbkYJUWElBZgztLUJX0DGHAHXKOcvAFMrtG8Gf65K0dR4=s120-c-rp-mo-br100,https://www.google.com/maps/contrib/106621565360662674570?hl=en,,,,,,,,,,,,,,,,,,en,35
1014,XI YAN SEAFOOD RESTAURANT (禧宴海鲜酒家),5,Good food and reasonable prices. Pepper crab is tasty and steam fish well cooked. Will come back again.,2021-07-16T12:59:38.249Z,0,Francis Pang,6.0,False,,,2 years ago,,,,,,,,,ChZDSUhNMG9nS0VJQ0FnSURxMl9lVldREAE,https://lh5.googleusercontent.com/p/AF1QipPQqgLKFHI806nUEaA8HKKJsPxyFglHDRNMSHqp=w150-h150-k-no-p,,,,,,,,,,,,,,,,,,,,,,,,,,,,,,,,,,,Google,https://www.google.com/maps/reviews/data=!4m8!14m7!1m6!2m5!1sChZDSUhNMG9nS0VJQ0FnSURxMl9lVldREAE!2m1!1s0x0:0x6748e437e9bb822b!3m1!1s2@1:CIHM0ogKEICAgIDq2_eVWQ%7CCgsIuoXGhwYQoMaFdw%7C?hl=en,118089740266420244889,https://lh3.googleusercontent.com/a-/ALV-UjXT1hDLH05e_W6qI_4SnagSNZaXEflaKLg6XERQo-CAi64=s120-c-rp-mo-br100,https://www.google.com/maps/contrib/118089740266420244889?hl=en,,,,,,,,,,,,,,,,,,en,18
7741,Hyderabad Bawarchi Authentic North Indian Restaurant,5,Butter chicken biryani among the better ones I tried. Pappadom so light and crispy that the fan easily blew it off the plate and I couldn't resist buying more. Will be back to try other stuff for as long as I'm still working in the area.,2023-08-16T05:30:22.639Z,0,Luqman Haniff Omar,11.0,True,,,6 months ago,,Lunch,,$10–20,,5.0,5.0,5.0,ChZDSUhNMG9nS0VJQ0FnSURwaExyc1B3EAE,https://lh5.googleusercontent.com/p/AF1QipNlk-Wnn_S975FKs4Lg21UE4fDGlye9NoFOkBpa=w150-h150-k-no-p,https://lh5.googleusercontent.com/p/AF1QipNRqSCoQCjlcgjcmI2snSTty2A20FBtIKrzjkFU=w150-h150-k-no-p,,,,,,,,,,,,,,,,,,,,,,,,,,,,,,,,,,Google,https://www.google.com/maps/reviews/data=!4m8!14m7!1m6!2m5!1sChZDSUhNMG9nS0VJQ0FnSURwaExyc1B3EAE!2m1!1s0x0:0xd12c60026169718f!3m1!1s2@1:CIHM0ogKEICAgIDphLrsPw%7CCgwI7r3xpgYQsNGLsQI%7C?hl=en,118433433618158309728,https://lh3.googleusercontent.com/a/ACg8ocIQNZP4eegn1Kcn8JBmJCjfjziFA91DjY_LY68c6ZaaVQ=s120-c-rp-mo-ba3-br100,https://www.google.com/maps/contrib/118433433618158309728?hl=en,,,,,,,,,,,,,,,,,,en,46
8697,Sapore Italian Restaurant,5,"We have been frequenting the restaurant for the last few weeks. It’s been a great pleasure to dine here as the food is authentic, the service is solid, and the ambiance of the alfresco dining area is peaceful. Moreover, it’s extremely value for money. Definitely recommend you giving this place a try.

Our family favorites are pan-fried sea-bass, the calzone (upon request), and the homemade tagliatelle pasta dishes. The ingredients are authentic and unpretentious, and are ultimately comforting. Oh, and the desserts (tiramisu and molten-lava cakes) are delectable as well.",2020-09-20T11:09:16.804Z,3,Chong Ronnie,1.0,False,,,3 years ago,,,,,,,,,ChdDSUhNMG9nS0VJQ0FnSURDNHB1enlBRRAB,https://lh5.googleusercontent.com/p/AF1QipO9xSXNXAoCw267uUYXsOKc2VjqlOMqo8XghQqv=w150-h150-k-no-p,https://lh5.googleusercontent.com/p/AF1QipP8oEWIaBqGxU7hqTIzcP7jOjETiaS6m0QHQfzp=w150-h150-k-no-p,https://lh5.googleusercontent.com/p/AF1QipMEfhWMcVXmo5ZN0XU3EqVEcsMipULH7K3pMSpk=w150-h150-k-no-p,https://lh5.googleusercontent.com/p/AF1QipOMZ81MLmmKG5IGuyNYE6MFYsCPK7uLe0uY2KKp=w150-h150-k-no-p,https://lh5.googleusercontent.com/p/AF1QipMoo_5vRuLFpZDhzAUuQmCC0229BEXYn4IlVJw-=w150-h150-k-no-p,https://lh5.googleusercontent.com/p/AF1QipMWWRPIGkwgOyIVT2hXteKQE4sZbIIpb40JzZX5=w150-h150-k-no-p,https://lh5.googleusercontent.com/p/AF1QipNZ9NE27cQR0OUq5sszbtJeXZeNbN-hrcyqvF73=w150-h150-k-no-p,https://lh5.googleusercontent.com/p/AF1QipOxhgDlJ7wZXXceqtGZU7t1xt8Q4sZlICpWOwKC=w150-h150-k-no-p,,,,,,,,,,,,,,,,,,,,,,,,,,,,Google,https://www.google.com/maps/reviews/data=!4m8!14m7!1m6!2m5!1sChdDSUhNMG9nS0VJQ0FnSURDNHB1enlBRRAB!2m1!1s0x0:0xf8fb5e3cd94b8eb4!3m1!1s2@1:CIHM0ogKEICAgIDC4puzyAE%7CCgwI3PCc-wUQ4L3G_wI%7C?hl=en,101876050936309131609,https://lh3.googleusercontent.com/a/ACg8ocIPvl8bFb4wa3LCicH5bA8Rk_9DoZwEuy-qKa2tiOYl=s120-c-rp-mo-br100,https://www.google.com/maps/contrib/101876050936309131609?hl=en,,,,,,,,,,,,,,,,,,en,90
8588,Wanglee Seafood Restaurant,5,This super affordable Tze char has the best sweet and sour pork rice ever. Beats the top restaurants flat with this single dish. 😊,2023-05-03T14:47:44.764Z,0,Chris SG,163.0,True,2023-10-30T07:45:10.780Z,,10 months ago,,Lunch,,$1–10,Dine in,,,,ChdDSUhNMG9nS0VJQ0FnSURSODktc3BnRRAB,https://lh5.googleusercontent.com/p/AF1QipNlwQK_JiFjmEzT3aCcJEx-68yqn9OdelLy8H8N=w150-h150-k-no-p,,,,,,,,,,,,,,,,,,,,,,,,,,,,,,,,,,,Google,https://www.google.com/maps/reviews/data=!4m8!14m7!1m6!2m5!1sChdDSUhNMG9nS0VJQ0FnSURSODktc3BnRRAB!2m1!1s0x0:0xff3264dd72899491!3m1!1s2@1:CIHM0ogKEICAgIDR89-spgE%7CCgwIkOjJogYQ6Mu07AI%7C?hl=en,118301042945741620173,https://lh3.googleusercontent.com/a/ACg8ocJqTSvFYr96rJ_GkCuKL6-FeAlMyBF8jBf3phPr13xwbA=s120-c-rp-mo-ba5-br100,https://www.google.com/maps/contrib/118301042945741620173?hl=en,,,,,,,,,,,,,,,,,,en,24
6540,Anjappar Chettinad Restaurant,5,Very nice new Indian shop in this area. Must try “Ghee Masala Dosai”,2024-01-23T12:12:27.716Z,1,WH Lee,9.0,False,,,a month ago,,Dinner,,$10–20,Dine in,5.0,5.0,5.0,ChdDSUhNMG9nS0VJQ0FnSUROOGFEZjNnRRAB,https://lh5.googleusercontent.com/p/AF1QipNZhhfX4u2lsXpsCibC4Nd9RAqXDcyuMx503mBv=w150-h150-k-no-p,https://lh5.googleusercontent.com/p/AF1QipOCjDJhQqDh5JQDlLOY8Q3iDbQgmWqMJMWSeOAV=w150-h150-k-no-p,https://lh5.googleusercontent.com/p/AF1QipPL8kY6dVFTIiygtKig6qPACgDu8xZzfd2eJylQ=w150-h150-k-no-p,https://lh5.googleusercontent.com/p/AF1QipPRpjgNo7jq-UK6j6S3L92tDC8y_rznSoyXK-Mo=w150-h150-k-no-p,https://lh5.googleusercontent.com/p/AF1QipPxF_oCPU4IfY6YXfOh-_FqaimEL_bSItJBFKOh=w150-h150-k-no-p,https://lh5.googleusercontent.com/p/AF1QipPuduExzYhAUhPq1zzS4tiItr5yRHjdUKyxgp2S=w150-h150-k-no-p,https://lh5.googleusercontent.com/p/AF1QipPxLhrNOEmuDDJBm2OLGMTNeLJ2dIq2OZoxfKnl=w150-h150-k-no-p,,,,,,,,,,,,,,,,,,,,,,,,,,,,,Google,https://www.google.com/maps/reviews/data=!4m8!14m7!1m6!2m5!1sChdDSUhNMG9nS0VJQ0FnSUROOGFEZjNnRRAB!2m1!1s0x0:0xb1dc30d1e62b0a12!3m1!1s2@1:CIHM0ogKEICAgIDN8aDf3gE%7CCgwIq9q-rQYQ4PLf1QI%7C?hl=en,106513330310419550264,https://lh3.googleusercontent.com/a-/ALV-UjXksoIUYys2muKxjXs4t4wVOWID33_5vTeFGynHU9N4pos=s120-c-rp-mo-br100,https://www.google.com/maps/contrib/106513330310419550264?hl=en,,,,,,,,,,,,,,,,,,en,13
2340,Tangerine,5,Without a doubt the best meal I ate in my entire time in Singapore. This was despite the fact that I was eating from a set menu which perhaps didn't represent my natural taste. Every course was delicious. The scallops were of particular note. Perfectly cooked. The sous vide pork is unmissable and comes beautifully presented with edible flowers. Staff were impeccable and of course one is looking out on the beautiful tropical surroundings of Espa. Recommend.,2016-01-23T05:26:33.828Z,0,Jill Pollock,95.0,True,,,8 years ago,,,,,,,,,ChdDSUhNMG9nS0VJQ0FnSUNnbk1PU3pnRRAB,,,,,,,,,,,,,,,,,,,,,,,,,,,,,,,,,,,,Google,https://www.google.com/maps/reviews/data=!4m8!14m7!1m6!2m5!1sChdDSUhNMG9nS0VJQ0FnSUNnbk1PU3pnRRAB!2m1!1s0x0:0x3e8cdfca6a36f0fc!3m1!1s2@1:CIHM0ogKEICAgICgnMOSzgE%7CCgwIiZ6MtQUQgI7pigM%7C?hl=en,117207828031191159044,https://lh3.googleusercontent.com/a-/ALV-UjVIUSq_4bDAxgSMrmtv47VtMHYGIe-Oy_I5Ji-wI8sn2q0=s120-c-rp-mo-ba4-br100,https://www.google.com/maps/contrib/117207828031191159044?hl=en,,,,,,,,,,,,,,,,,,en,77
2805,Kia Hiang,5,"Tuesday lunch. We had signature claypot chicken, egg omelette and 2 dishes of vegitables. The claypot chicken was delivered boiling like magma:) I’d love to know how they can make chicken so tender. Their service is swift and  friendly",2023-04-10T06:10:25.932Z,0,Reiko Naka,81.0,False,,,10 months ago,,Lunch,,$20–30,Dine in,,,,ChdDSUhNMG9nS0VJQ0FnSUNSMDh2cTFRRRAB,,,,,,,,,,,,,,,,,,,,,,,,,,,,,,,,,,,,Google,https://www.google.com/maps/reviews/data=!4m8!14m7!1m6!2m5!1sChdDSUhNMG9nS0VJQ0FnSUNSMDh2cTFRRRAB!2m1!1s0x0:0x155d9812b8f82fea!3m1!1s2@1:CIHM0ogKEICAgICR08vq1QE%7CCgwI0dDOoQYQ6InUvAM%7C?hl=en,115439043642242306002,https://lh3.googleusercontent.com/a/ACg8ocLdLdYb562T287cnlkZphRK_cYgfxiq0mONRcTylwFM=s120-c-rp-mo-ba4-br100,https://www.google.com/maps/contrib/115439043642242306002?hl=en,,,,,,,,,,,,,,,,,,en,39
2391,Family Flavor Restaurant,5,"A cozy authentic Chinese restaurant in New Upper Changi Road. Value for money. Ordered sliced pork strips with green capsicum n 5 sticks of beef BBQ , goes well with a small bowl of rice.",2021-07-01T09:22:42.876Z,2,KL Tan,3.0,False,2021-07-01T10:28:02.671Z,,2 years ago,,,,,,,,,ChZDSUhNMG9nS0VJQ0FnSURxck1PX0pnEAE,https://lh5.googleusercontent.com/p/AF1QipNFVWQY86jpqChz_TXKyEsyhldtbHbUXd_VfGQX=w150-h150-k-no-p,https://lh5.googleusercontent.com/p/AF1QipM3f-Fh4iw_FoOchaLmckmNsDbzpyx5-3QlX8Yp=w150-h150-k-no-p,,,,,,,,,,,,,,,,,,,,,,,,,,,,,,,,,,Google,https://www.google.com/maps/reviews/data=!4m8!14m7!1m6!2m5!1sChZDSUhNMG9nS0VJQ0FnSURxck1PX0pnEAE!2m1!1s0x0:0x963d5d1084d2a1d7!3m1!1s2@1:CIHM0ogKEICAgIDqrMO_Jg%7CCgwI4pL2hgYQwMT6oQM%7C?hl=en,111157729398349127776,https://lh3.googleusercontent.com/a-/ALV-UjVfwO6_OtQGsSSszVH_i3V-SJcB3gi8JDfbUDclKyv8D9A=s120-c-rp-mo-br100,https://www.google.com/maps/contrib/111157729398349127776?hl=en,,,,,,,,,,,,,,,,,,en,35
7180,Kelly Jie Seafood (TPY Mellben Seafood) 龍海鲜螃蟹王,4,"1st visit.  Didn't want to get messy and avoided items that need to be deshell.
Food - Good. Unique dish like Truffle Ice Plant Salad, Chilled & Crispy Sweet & Sour Pork. The Ice Cream (with Mao Tai) is unique, too (the serving can be better)
Good service. However, the place can be noisy.
Will visit in the future to try the crab dishes.",2023-12-02T07:32:27.504Z,0,Andrew Tan,265.0,False,,,3 months ago,,Dinner,,$50–60,Dine in,3.0,4.0,4.0,ChdDSUhNMG9nS0VJQ0FnSURsdnJPUWpnRRAB,https://lh5.googleusercontent.com/p/AF1QipMJRgcPA2Asz4YTCQtxqGEZ-oKBYKETx0sJjopB=w150-h150-k-no-p,https://lh5.googleusercontent.com/p/AF1QipMRQ813PvFBAKs7I95kcEVlXnZSHJbuCc2yFlrI=w150-h150-k-no-p,https://lh5.googleusercontent.com/p/AF1QipM8AraRDlMdpYDhsiyhDQBIbRWNQ-1ZdsEaQfZ5=w150-h150-k-no-p,https://lh5.googleusercontent.com/p/AF1QipN_3-HiWqaFbuVnyHVf4yMaX_6ZNSpMLMlBQsi6=w150-h150-k-no-p,https://lh5.googleusercontent.com/p/AF1QipPTd7ijWP913mhdnOHWW-Bkf-b-prXrCcgjV1U7=w150-h150-k-no-p,https://lh5.googleusercontent.com/p/AF1QipO9ZWkNs3346aiu25cum382fji2hrIUiNXN0Tjr=w150-h150-k-no-p,https://lh5.googleusercontent.com/p/AF1QipPZRVJD4r6-RJ_fTsLvpPSlPPE4jbFpRYpwU316=w150-h150-k-no-p,https://lh5.googleusercontent.com/p/AF1QipOYxS_szhPXfQO2pAUqKXwBhTrSnk1wLtOiStMU=w150-h150-k-no-p,,,,,,,,,,,,,,,,,,,,,,,,,,,,Google,https://www.google.com/maps/reviews/data=!4m8!14m7!1m6!2m5!1sChdDSUhNMG9nS0VJQ0FnSURsdnJPUWpnRRAB!2m1!1s0x0:0x9b90359aa86f9f5e!3m1!1s2@1:CIHM0ogKEICAgIDlvrOQjgE%7CCgwIi7urqwYQyLus8AE%7C?hl=en,111113632147420313888,https://lh3.googleusercontent.com/a/ACg8ocIkcT9jtt7X30bCcwTIT212jQHDs-IfiCJvGaL-UNns=s120-c-rp-mo-br100,https://www.google.com/maps/contrib/111113632147420313888?hl=en,,,,,,,,,,,,,,,,,,en,64
