4920,terra Tokyo Italian,5,"As with Tras street, the eateries are in abundance within the area and over here, the nice restaurants are tucked amongst the shop houses.

It was a business lunch and we went for their omakase set lunch and the chef chooses what to serve based on the pricing. We had the $208 set. Needless to say, it’s worth every penny. Every dish will be easily 8/10. We were served 6-7 dishes and you will be well fed as I was worried having to do another round of ramen along Tanjong Pagar after this session. :)

One of the highlights will be the uni that’s generously perched on the pastry puff and the caviar too.

The tuna carpaccio was decent but didn’t shine as there are two more dishes that stood out - Japanese promfret and the A4 striploin. The promfret melts in your mouth with a strong seafoody taste that anybody will die for if you’re a seafoodie.

I couldn’t remember all the sauces and condiments that accompanied all the dishes. Just too many details but they tasted wonderful and complemented each dish just so aptly.

The dessert was a panna cotta with wild berries.",2022-08-23T07:32:13.413Z,2,Anton Mo,30.0,False,,,a year ago,,Lunch,,,Dine in,,,,ChZDSUhNMG9nS0VJQ0FnSUR1MGZfTk9BEAE,https://lh5.googleusercontent.com/p/AF1QipM7fWSGHAlWWR_9W72IWr9w3PFgXlnDL8GQ8_H8=w150-h150-k-no-p,https://lh5.googleusercontent.com/p/AF1QipOKl6U4qvoZ7QM8nWfnAtcI-rFH_owuo5tnb8nR=w150-h150-k-no-p,https://lh5.googleusercontent.com/p/AF1QipMqBQD4zzAF27zXIpg6lyBhD3JUQlnVqq7uAJuM=w150-h150-k-no-p,https://lh5.googleusercontent.com/p/AF1QipPAGrSYaXn3_mNWCUxBLG173bm0z50s4h84b8VA=w150-h150-k-no-p,https://lh5.googleusercontent.com/p/AF1QipNXsEqhCjl6mgdIiCX2a3Q7-UfGnJnBx3yVfUXd=w150-h150-k-no-p,https://lh5.googleusercontent.com/p/AF1QipNZ1uRKD1hK31XTs1mbNM05fMycqobd6NfKkEDt=w150-h150-k-no-p,https://lh5.googleusercontent.com/p/AF1QipMR15VybHHxaa0bTa0Tz6y5yPhWTn_JXsN3A8Xa=w150-h150-k-no-p,https://lh5.googleusercontent.com/p/AF1QipNsdj5MmEDPi4w97GPQ2VE_tJS7J20XaMC8lour=w150-h150-k-no-p,https://lh5.googleusercontent.com/p/AF1QipM4Ycll18VPiuRje_43v9rjwnVB71O67JVUWR48=w150-h150-k-no-p,https://lh5.googleusercontent.com/p/AF1QipONeo0KgTZANSglgRfOcCDVSXR4nMtVW2x5CLxE=w150-h150-k-no-p,https://lh5.googleusercontent.com/p/AF1QipNf7C8YIxwrszgCXdhNbu_3MdTqbONVPWDxzk4Z=w150-h150-k-no-p,https://lh5.googleusercontent.com/p/AF1QipNYrnrjxz5QBA4vGAShlesC40ASiKG3XZDkHa2l=w150-h150-k-no-p,https://lh5.googleusercontent.com/p/AF1QipMBoUVoEVeZ7IRZE5mO7WuK_s-dYcE_3iUOhfal=w150-h150-k-no-p,,,,,,,,,,,,,,,,,,,,,,,Google,https://www.google.com/maps/reviews/data=!4m8!14m7!1m6!2m5!1sChZDSUhNMG9nS0VJQ0FnSUR1MGZfTk9BEAE!2m1!1s0x0:0x7c099fd02344f096!3m1!1s2@1:CIHM0ogKEICAgIDu0f_NOA%7CCgwI_YSSmAYQkJmKxQE%7C?hl=en,108082201059069674150,https://lh3.googleusercontent.com/a-/ALV-UjWRDOEtZut_KnJ7JFYfhkpbZ6bk4_rRj2tDzb-oZKh0OJc=s120-c-rp-mo-br100,https://www.google.com/maps/contrib/108082201059069674150?hl=en,,,,,,,,,,,,,,,,,,en,195
6621,Beng Hiang Restaurant,4,"Date of visit : Sun 19 Nov 2023
Time : 1 pm

Celebrated my mum’s 94th birthday here. 12 of us. Preordered suckling pig and the birthday buns.

Ordered 8 dishes : 7 dishes + 1 dessert.
The suckling pig is excellent.
Fried mian xian, yam ring and roast chicken also good.
The fried watercress, 大菜 the dessert yam paste orh nee soso.

Date of visit : Sat 21 Jan 2023
Time : 6 pm

Came here again to celebrate CNY. Restaurant’s really packed to the brim, people in joyous mood.

We ordered the $738+ menu. Started with lohei as usual. The 2nd dish fish maw soup came a bit late, about 30 mins later. So everything else was being delayed.

Also a bit disorganized as tables were not grouped by type of chosen menu, so staff at times didn’t know which table to serve.

Clearly not enough manpower and staff was busy.

Roast chicken was good. Braised mushroom with spinach too and the red bean sesame ball dessert.
Steamed grouper was soso.

Date of visit : Sun 30 Oct 2022
Time : 12.45 pm

Reserved a table for 12 in advance as my mum wanted to celebrate her 93th birthday here. The whole place seemed full.

Called ahead also to order a big pomfret about 1 kg+ and also the longevity buns - a pack of 18 costing about $40.

The longevity buns look beautiful. We are reminded not to consume the big bun nor the small teeny weeny apple like decoration buns.

Service is good : some dishes are divided into equal portions for us.

The Teochew style steamed pomfret lacks the same flavor as other Teochew restaurants. The deep fried oyster omelette is so thin and crispy that it’s unlike those sold at hawker centres.

A traditional restaurant with her loyal customers and above average food standards.",2023-11-21T06:43:17.159Z,1,Sunny M,436.0,False,,,3 months ago,,Lunch,,,Dine in,,,,ChZDSUhNMG9nS0VJQ0FnSUMteXBLbU93EAE,https://lh5.googleusercontent.com/p/AF1QipPIiLlZaqrA73VKg24yxlLMVE_zX9x0vGvFPEud=w150-h150-k-no-p,https://lh5.googleusercontent.com/p/AF1QipNN8HoTJdDwgGmkg-Muj42bzAuagKr3ZL7wZK-m=w150-h150-k-no-p,https://lh5.googleusercontent.com/p/AF1QipNHXudfHNaibztnPy0nNp7V2Rs0oPY8uAZA0H6T=w150-h150-k-no-p,https://lh5.googleusercontent.com/p/AF1QipMOta9cyiQ2dyudsmP_MIA-7Z0Rco1QkqigwNM6=w150-h150-k-no-p,https://lh5.googleusercontent.com/p/AF1QipO41BLmm2Rs6JgRtcnALxR6DDTDZKjl7KNutIhx=w150-h150-k-no-p,https://lh5.googleusercontent.com/p/AF1QipOJETrc9j7CWlP8dpblijkGOCDPUnlrcBoC5sAk=w150-h150-k-no-p,https://lh5.googleusercontent.com/p/AF1QipPW6NfgtK2YS40-KRo5lX_1LNcdgiA7n7iq_MJp=w150-h150-k-no-p,https://lh5.googleusercontent.com/p/AF1QipOKUZ8kfo66i29S_XPjjYqkaixeHux_a1JXKHtt=w150-h150-k-no-p,https://lh5.googleusercontent.com/p/AF1QipNSCZyV59mlQRwblvuMWXWgbun0HA4y8RZhCSfY=w150-h150-k-no-p,https://lh5.googleusercontent.com/p/AF1QipNXynoN3FTNg_1MxbgZo7iHvhrglszfZ1LYg5A5=w150-h150-k-no-p,https://lh5.googleusercontent.com/p/AF1QipNsIHCB9ArcFrPIP5HjUllfaesDJ9GUbsyR7-Do=w150-h150-k-no-p,https://lh5.googleusercontent.com/p/AF1QipMb-Y79orkTKVqEj2u4Kz6lERzonccD9uryT6jE=w150-h150-k-no-p,https://lh5.googleusercontent.com/p/AF1QipP7UoZ_j319zOJc8oy_GoCmpgjdIxIRkpXD7FQr=w150-h150-k-no-p,https://lh5.googleusercontent.com/p/AF1QipPlM0QjEOoxSQePUQNI8JIHMv0ic4zl-wm6Rve4=w150-h150-k-no-p,https://lh5.googleusercontent.com/p/AF1QipNPLixiguVcP7kRQtlJ_LfTuVtvCGUNop5A6UQ9=w150-h150-k-no-p,https://lh5.googleusercontent.com/p/AF1QipNyrNporBFckzvee24SDwJhAAFDJsv3QTpjw1K0=w150-h150-k-no-p,https://lh5.googleusercontent.com/p/AF1QipPDjYg738nTe5PUkvXuRnkN9nqKiszcT45lJWyx=w150-h150-k-no-p,https://lh5.googleusercontent.com/p/AF1QipPq7yCxD26t-xcn83POavLY2MM9pxkLewKCOabq=w150-h150-k-no-p,https://lh5.googleusercontent.com/p/AF1QipOX8kFVfHuhjcJxDYvuoZwafIxfa6iKYAFi9rzN=w150-h150-k-no-p,,,,,,,,,,,,,,,,,Google,https://www.google.com/maps/reviews/data=!4m8!14m7!1m6!2m5!1sChZDSUhNMG9nS0VJQ0FnSUMteXBLbU93EAE!2m1!1s0x0:0x241e0705243952b5!3m1!1s2@1:CIHM0ogKEICAgIC-ypKmOw%7CCgsIhaPxqgYQyKeBTA%7C?hl=en,116788322544213433170,https://lh3.googleusercontent.com/a/ACg8ocJltV77p7YRsg0U4gG4RqYnfnv-_vKdO1w6vrcHx6PW=s120-c-rp-mo-ba6-br100,https://www.google.com/maps/contrib/116788322544213433170?hl=en,,,,,,,,,,,,,,,,,,en,310
7774,Al Rabeca Restaurant 24 Hrs,5,Thoroughly enjoyed the boneless mutton and spinach lentil dish. A must try if you’re in the area.,2022-01-19T08:07:48.902Z,1,Rishi Anand,7.0,False,2022-01-19T11:00:17.324Z,,2 years ago,,,,,,,,,ChZDSUhNMG9nS0VJQ0FnSURtcEtLR1ZnEAE,,,,,,,,,,,,,,,,,,,,,,,,,,,,,,,,,,,,Google,https://www.google.com/maps/reviews/data=!4m8!14m7!1m6!2m5!1sChZDSUhNMG9nS0VJQ0FnSURtcEtLR1ZnEAE!2m1!1s0x0:0xbac5bc396e1f1a68!3m1!1s2@1:CIHM0ogKEICAgIDmpKKGVg%7CCgwI1I2fjwYQ2ObFrgM%7C?hl=en,102549255245993446363,https://lh3.googleusercontent.com/a-/ALV-UjWcXn1Hp9IwXxGkkUyRr20cdBhWQrD38bDYxLWvCjJT0r4=s120-c-rp-mo-br100,https://www.google.com/maps/contrib/102549255245993446363?hl=en,,,,,,,,,,,,,,,,,,en,17
8988,81 Restaurant,5,Cheap and good food. Regular lunch place with colleagues. Good for large groups,2019-10-11T12:29:51.974Z,0,D L,624.0,True,,,4 years ago,,,,,,,,,ChdDSUhNMG9nS0VJQ0FnSUMwbTYyVm5BRRAB,https://lh5.googleusercontent.com/p/AF1QipM7iTs3CbFrlXVCIcctU3erSGCz5ShFkFY8zYlj=w150-h150-k-no-p,https://lh5.googleusercontent.com/p/AF1QipPmwL0r0OjmO-lm_BAqyB22G7D5AeXiMd_ghhI7=w150-h150-k-no-p,https://lh5.googleusercontent.com/p/AF1QipMnP4ApWMpB_KWgIjlXG2ybk7iQzP8Z-OiPrUFK=w150-h150-k-no-p,,,,,,,,,,,,,,,,,,,,,,,,,,,,,,,,,Google,https://www.google.com/maps/reviews/data=!4m8!14m7!1m6!2m5!1sChdDSUhNMG9nS0VJQ0FnSUMwbTYyVm5BRRAB!2m1!1s0x0:0x98b61a7701dc5b21!3m1!1s2@1:CIHM0ogKEICAgIC0m62VnAE%7CCgwIv-uB7QUQgOvy0AM%7C?hl=en,104966613744701231932,https://lh3.googleusercontent.com/a-/ALV-UjXgdJu1MsOaXqdbqzMv9Dh1bLLjBo52p3WFMWmz2gdDKp4=s120-c-rp-mo-ba6-br100,https://www.google.com/maps/contrib/104966613744701231932?hl=en,,,,,,,,,,,,,,,,,,en,13
3128,U Taste Restaurant,1,OMG! THE WORST EXPERIENCED I EVER HAD! ASKED THE AUNTY NICELY IF BITTERGOURD SLICED FISH NOODLE IS AVAILABLE AND SHE SUDDENLY RAISED HER VOICE AND TOLD ME THAT THEY DO NOT HAVE BITTERGOURD! ALL THE WAY SHE SHOUTED AT ME WHEN I'M HANDLING MY BABY SON ON THE OTHER HAND! NOT TO SURE IF ITS ME OR SHE IS HAVING A BAD DAY. FIRST AND THE LAST TO EVER BUY MY DINNER THERE!,2022-10-27T13:26:35.529Z,1,Yun Nikko,34.0,True,,,a year ago,,,,,,1.0,1.0,1.0,ChdDSUhNMG9nS0VJQ0FnSUMteE5fR3lRRRAB,,,,,,,,,,,,,,,,,,,,,,,,,,,,,,,,,,,,Google,https://www.google.com/maps/reviews/data=!4m8!14m7!1m6!2m5!1sChdDSUhNMG9nS0VJQ0FnSUMteE5fR3lRRRAB!2m1!1s0x0:0xa342ba1cea252cbc!3m1!1s2@1:CIHM0ogKEICAgIC-xN_GyQE%7CCgwIi47qmgYQkOHH_AE%7C?hl=en,109865916757493007495,https://lh3.googleusercontent.com/a-/ALV-UjWWT7xI2-UhMpVDKtgkjBtfOllXeKM8f85EZTp2eAYqHmeM=s120-c-rp-mo-ba3-br100,https://www.google.com/maps/contrib/109865916757493007495?hl=en,,,,,,,,,,,,,,,,,,en,73
1530,Tea House by Soup Restaurant - IMM,2,"This place is easily missable, walked one whole round of level 1 and didnt notice I passed by it... its ridiculous how its camouflaged by the other stores.

Not a conducive place to chat while eating as the waiters keep clanging the cutlery when keeping the dishes and the sound just reverbs throughout the restaurant.

Would like to comment how funny it was their soup bowl is even smaller than their rice bowl, which was already small enough, about the size of a petit woman's  palm. How do you expect people to drink from the bowls with ingredients in it?

White rice was so little, served in a small lil tiny bowl.
Ordered their 2 pax chicken set on the front of the menu thinking its their signature dish but the chicken and the cucumber are horrible. Not fresh and super dry. It was 35++ for that chicken and soup. Not worth it. Paid 77 for 2 pax for the whole dinner (included an extra tray of siew mai and fried fish)

At the end noticed people only come here for the dimsum. But there are better dimsums out there.",2023-03-28T10:33:49.167Z,0,Jaclyn H.Y,71.0,True,,,11 months ago,,,,,,2.0,2.0,3.0,ChZDSUhNMG9nS0VJQ0FnSURocGJlVERBEAE,https://lh5.googleusercontent.com/p/AF1QipOy-ByglpZRXyMRdbBXfF6SvpJa8HODj4q5FHbL=w150-h150-k-no-p,https://lh5.googleusercontent.com/p/AF1QipNiLq4NAmSOgltf9HjTAdYDA0K4zTtf_E79DK5N=w150-h150-k-no-p,https://lh5.googleusercontent.com/p/AF1QipMhldlfFckrcjyFAQ1WzhmuJfjfCpzIaW39IusE=w150-h150-k-no-p,https://lh5.googleusercontent.com/p/AF1QipNDYkRGCDc8_UIV6ZiIV0mm9LfTGwOgG4hvbx0Z=w150-h150-k-no-p,https://lh5.googleusercontent.com/p/AF1QipPgtsD7l4EyTVQg5qb6MhGS6kR0qOf8rGi0FvSU=w150-h150-k-no-p,https://lh5.googleusercontent.com/p/AF1QipNRg4G-iNCUCoP6kotCnhGyIiHi79098ke5CaiO=w150-h150-k-no-p,,,,,,,,,,,,,,,,,,,,,,,,,,,,,,Google,https://www.google.com/maps/reviews/data=!4m8!14m7!1m6!2m5!1sChZDSUhNMG9nS0VJQ0FnSURocGJlVERBEAE!2m1!1s0x0:0xf8ef1f0c980d0603!3m1!1s2@1:CIHM0ogKEICAgIDhpbeTDA%7CCgsIjYWLoQYQ6NvuTw%7C?hl=en,108914695029741058952,https://lh3.googleusercontent.com/a/ACg8ocLd3_hNeH7mq0nRzc7SaDIsMLYsDY6q_owhCUp9DGn8Xw=s120-c-rp-mo-ba6-br100,https://www.google.com/maps/contrib/108914695029741058952?hl=en,,,,,,,,,,,,,,,,,,en,190
10233,城记海鲜 Happy Chef Kitchen,5,"Came here for dinner with family. It was located in a coffee shop and most patron that time were eating from here.

The service was good and the food were above average. The cai pu toufu was good imo.",2024-02-24T12:30:02.726Z,0,Ooi Tuan Hann,28.0,True,,,a week ago,,Dinner,,$20–30,Dine in,4.0,4.0,5.0,ChdDSUhNMG9nS0VJQ0FnSURka2ZyMV9RRRAB,https://lh5.googleusercontent.com/p/AF1QipN5uGe0-uQYImZlqRD9-JgnxE7g45opMEH0TRm_=w150-h150-k-no-p,https://lh5.googleusercontent.com/p/AF1QipNhdzNlXxFYZJgsdQ9Np1QiBzm1WqMeNHaUoAeW=w150-h150-k-no-p,,,,,,,,,,,,,,,,,,,,,,,,,,,,,,,,,,Google,https://www.google.com/maps/reviews/data=!4m8!14m7!1m6!2m5!1sChdDSUhNMG9nS0VJQ0FnSURka2ZyMV9RRRAB!2m1!1s0x0:0x255ad366ca329289!3m1!1s2@1:CIHM0ogKEICAgIDdkfr1_QE%7CCgwIysLnrgYQqIaZ2gI%7C?hl=en,113143091738148948530,https://lh3.googleusercontent.com/a-/ALV-UjVanI6nsXe_tq05_8x4lF6RFsyaPpYwinMPIzoclTbZx99p=s120-c-rp-mo-ba3-br100,https://www.google.com/maps/contrib/113143091738148948530?hl=en,,,,,,,,,,,,,,,,,,en,39
7773,Al Rabeca Restaurant 24 Hrs,1,What the point of fan if you did not on it,2023-11-02T09:23:40.832Z,0,Mat Bond,152.0,True,,,4 months ago,,,,,,1.0,,,ChZDSUhNMG9nS0VJQ0FnSUNGaTg3OGFREAE,,,,,,,,,,,,,,,,,,,,,,,,,,,,,,,,,,,,Google,https://www.google.com/maps/reviews/data=!4m8!14m7!1m6!2m5!1sChZDSUhNMG9nS0VJQ0FnSUNGaTg3OGFREAE!2m1!1s0x0:0xbac5bc396e1f1a68!3m1!1s2@1:CIHM0ogKEICAgICFi878aQ%7CCgwInNWNqgYQyNSXjQM%7C?hl=en,104384729979047384342,https://lh3.googleusercontent.com/a/ACg8ocK5sZZ3abB5phTyoCRMOtwvw0wLliu6mhYNw4VlJVVP=s120-c-rp-mo-ba4-br100,https://www.google.com/maps/contrib/104384729979047384342?hl=en,,,,,,,,,,,,,,,,,,en,11
9554,Springleaf Prata Place - Jln Tua Kong,5,"The best pratas in Singapore

Alot of innovative ideas for fusion pratas.

Tried a whole-meal prata the last visit.

Pratas are also crispy and good sized.

The Fish curry is also fantastic. Rich, creamy and free-flow !",2023-07-08T15:07:00.760Z,0,John Chong,168.0,True,,,7 months ago,,Lunch,,$1–10,,3.0,5.0,3.0,ChdDSUhNMG9nS0VJQ0FnSUR4MUozOHNnRRAB,https://lh5.googleusercontent.com/p/AF1QipPthz8rEf9wEW6yuWijurk9owAbWfoDAmOqnzAE=w150-h150-k-no-p,https://lh5.googleusercontent.com/p/AF1QipN-1BvbJxRWw_no78ttk8edqFhI1i_MP9mCvIP0=w150-h150-k-no-p,https://lh5.googleusercontent.com/p/AF1QipPP5PDXwzk24q3p9i4_CLGDznv0Ncfn66Br5_TY=w150-h150-k-no-p,https://lh5.googleusercontent.com/p/AF1QipORAV18ZxGfdFtpu8efjv908fbMCzkxZi2FzAX6=w150-h150-k-no-p,https://lh5.googleusercontent.com/p/AF1QipO0AWDU2Vo_KQx6uRbj75R8AqatQs4XAInHmxTN=w150-h150-k-no-p,https://lh5.googleusercontent.com/p/AF1QipMyvo75T6JQ5emBlCJJjB67pQsUXH5ySMhJizmV=w150-h150-k-no-p,https://lh5.googleusercontent.com/p/AF1QipNoHKydDotIJ8sUEEr3WGR8X3JR_36y3AE4OR2x=w150-h150-k-no-p,https://lh5.googleusercontent.com/p/AF1QipPUk9gtLyzPKXK4XWSieN2iBjiwz2Q_Hw9cLWEY=w150-h150-k-no-p,https://lh5.googleusercontent.com/p/AF1QipOA2Pms1nHELrOK_ZwMfjmupL-gMEfN_cDkuSOF=w150-h150-k-no-p,,,,,,,,,,,,,,,,,,,,,,,,,,,Google,https://www.google.com/maps/reviews/data=!4m8!14m7!1m6!2m5!1sChdDSUhNMG9nS0VJQ0FnSUR4MUozOHNnRRAB!2m1!1s0x0:0x97608fadaecf310c!3m1!1s2@1:CIHM0ogKEICAgIDx1J38sgE%7CCgwIlPelpQYQqPLC6gI%7C?hl=en,117259692068414792619,https://lh3.googleusercontent.com/a-/ALV-UjVDIlJGsqFv_T6bcOLLjqPABVxlb3_u-_a4gG1DZVhG6N0L=s120-c-rp-mo-ba5-br100,https://www.google.com/maps/contrib/117259692068414792619?hl=en,,,,,,,,,,,,,,,,,,en,37
4629,Different Taste Cafe & Restaurant,4,"Place was noisy & vibrant.
Food is relatively good. Chendol was solid! However the Crispy Garlic Chicken was a letdown.
Nasi Lemak is above average,  Penang Kway Teow, fish maw soup & stir fried beef horfun are definitely good.
The service staffs are busy. So much so that they served the soup without sending us the bowls & serving food without cutleries. Understand that they are busy so we get them ourselves.",2023-05-21T13:10:03.954Z,2,D'sign & Build,2.0,False,,,9 months ago,,Dinner,,$10–20,Dine in,3.0,4.0,4.0,ChZDSUhNMG9nS0VJQ0FnSUN4dWFYck93EAE,https://lh5.googleusercontent.com/p/AF1QipOcHV8gm-vyVpa3wvs_BwhYjeARCvfM5rNyyAu8=w150-h150-k-no-p,https://lh5.googleusercontent.com/p/AF1QipMj5XJF6QU6gz8lFVGl9hSIl6YDuV1eLtGEK0o9=w150-h150-k-no-p,https://lh5.googleusercontent.com/p/AF1QipNHVss2qqHwBKQXEoy1uifGA_z-Ecp2p5eTWZvW=w150-h150-k-no-p,https://lh5.googleusercontent.com/p/AF1QipNOWfYI2TzZebAErW1LJ4csziBUk_25f_3zkLHs=w150-h150-k-no-p,https://lh5.googleusercontent.com/p/AF1QipNQrz9QLhZ8NDn4NpHf4WR5OuHT2Pbra9la8yiv=w150-h150-k-no-p,https://lh5.googleusercontent.com/p/AF1QipOPQOihV40V11xuNNDcowtdAxG5Nimrcbh4lWux=w150-h150-k-no-p,,,,,,,,,,,,,,,,,,,,,,,,,,,,,,Google,https://www.google.com/maps/reviews/data=!4m8!14m7!1m6!2m5!1sChZDSUhNMG9nS0VJQ0FnSUN4dWFYck93EAE!2m1!1s0x0:0x7f0e63e203c264be!3m1!1s2@1:CIHM0ogKEICAgICxuaXrOw%7CCgwIq7CoowYQoNv2xgM%7C?hl=en,104814238594781045606,https://lh3.googleusercontent.com/a-/ALV-UjVtuAaG2kCg2f-U-TPTBgCOcR-LMegrKBWHOoQfQftjNQ=s120-c-rp-mo-br100,https://www.google.com/maps/contrib/104814238594781045606?hl=en,,,,,,,,,,,,,,,,,,en,72
5128,Syun,5,A wonderful experience at Syun. High quality food and their lunch sets were of amazing value. Their signature beef with uni was divine to say the least! We appreciate the team who was on point with their service delivery and very attentive as well.,2023-12-18T13:52:23.357Z,1,J Li,7.0,False,2023-12-26T13:37:53.151Z,,2 months ago,,Lunch,Plenty of parking,,,5.0,5.0,5.0,ChdDSUhNMG9nS0VJQ0FnSURWOS1tR3FRRRAB,https://lh5.googleusercontent.com/p/AF1QipMadCxsdz1oJmAf7YvR0XDgrz_LSfUIwhPRP0XV=w150-h150-k-no-p,https://lh5.googleusercontent.com/p/AF1QipMBugwnCgkxopFfH4KEZE6bvOBMF9TYtFbWTd4e=w150-h150-k-no-p,https://lh5.googleusercontent.com/p/AF1QipNNOBOwQB19gtJ1tim62vFv_qYjrgJWkuC0vl9Z=w150-h150-k-no-p,https://lh5.googleusercontent.com/p/AF1QipPqD1dZrg4Lc9MMVnPOL4BoYnLKJXeOBPXNA83R=w150-h150-k-no-p,,,,,,,,,,,,,,,,,,,,,,,,,,,,,,,,Google,https://www.google.com/maps/reviews/data=!4m8!14m7!1m6!2m5!1sChdDSUhNMG9nS0VJQ0FnSURWOS1tR3FRRRAB!2m1!1s0x0:0x2347c4edd857cc79!3m1!1s2@1:CIHM0ogKEICAgIDV9-mGqQE%7CCgwIl52BrAYQ0NixqgE%7C?hl=en,109745982902490158314,https://lh3.googleusercontent.com/a/ACg8ocLl-AKNmCu3azb9EvqteqPYpjZzjDGbXguMbQa1HOjK=s120-c-rp-mo-br100,https://www.google.com/maps/contrib/109745982902490158314?hl=en,,,,,,,,,,,,,,,,,,en,44
2696,Restaurant Chaleur,5,"We celebrated our 7th wedding Anniversary at Chaleur and we were treated to one of the best dining experiences ever! Food was amazing in terms of variety, plating and taste! Staff were extremely friendly and approachable taking the effort to check on us and explain each dish in great detail. Chef Masa was extremely friendly as well and even walked us out when we left.

Will be back for their winter menu! Can’t wait!",2023-09-16T14:23:07.402Z,2,Shawn Yang,25.0,False,2023-12-24T11:02:37.085Z,,5 months ago,,,,,,5.0,5.0,5.0,ChZDSUhNMG9nS0VJQ0FnSUNaX1piUlhBEAE,https://lh5.googleusercontent.com/p/AF1QipPMFQ66S0SRtqIM4NqL8QHgC0p7rqzs3fYTK2mT=w150-h150-k-no-p,,,,,,,,,,,,,,,,,,,,,,,,,,,,,,,,,,,Google,https://www.google.com/maps/reviews/data=!4m8!14m7!1m6!2m5!1sChZDSUhNMG9nS0VJQ0FnSUNaX1piUlhBEAE!2m1!1s0x0:0xf35fc61bacac3c19!3m1!1s2@1:CIHM0ogKEICAgICZ_ZbRXA%7CCgwIy_SWqAYQ-In3vwE%7C?hl=en,111147105169339084738,https://lh3.googleusercontent.com/a/ACg8ocL01M1ccvaq9xqoOjMLqNxNpM3uDBTRbpqOEWVdup4U=s120-c-rp-mo-br100,https://www.google.com/maps/contrib/111147105169339084738?hl=en,,,,,,,,,,,,,,,,,,en,74
6915,McDonald's Toa Payoh Lorong,1,"I am deeply disappointed with this MacDonalds. I ordered a 20 piece nugget meal takeaway that comes with 4 tubs of curry sauce but to my utmost dismay, when I got home, I was met with 0 tubs of curry sauce. I called the MacDonalds to ask them to rectify this situation as I was really craving curry sauce with my nuggets.

They did nothing. Refer to picture attached (note: no curry sauce) I was forced to rawdog these nuggets with garlic chilli. Displeased.",2023-12-29T15:20:04.917Z,0,Nicole Emma Low,39.0,True,,,2 months ago,,Other,,$1–10,Take out,5.0,3.0,1.0,ChdDSUhNMG9nS0VJQ0FnSUMxdHZfNDdBRRAB,https://lh5.googleusercontent.com/p/AF1QipPamIL3SXPXLN-es9F7ryVOvKaEsko4gQzi2Wa4=w150-h150-k-no-p,,,,,,,,,,,,,,,,,,,,,,,,,,,,,,,,,,,Google,https://www.google.com/maps/reviews/data=!4m8!14m7!1m6!2m5!1sChdDSUhNMG9nS0VJQ0FnSUMxdHZfNDdBRRAB!2m1!1s0x0:0x4846abd704e20bd8!3m1!1s2@1:CIHM0ogKEICAgIC1tv_47AE%7CCgwIpMe7rAYQwNa4tQM%7C?hl=en,110492971802463184787,https://lh3.googleusercontent.com/a-/ALV-UjVOoId9ewxPzyV8SPw1IGlfsHQH-MVTwP2W6tWSbWQgMr4=s120-c-rp-mo-ba4-br100,https://www.google.com/maps/contrib/110492971802463184787?hl=en,,,,,,,,,,,,,,,,,,en,84
7178,Kelly Jie Seafood (TPY Mellben Seafood) 龍海鲜螃蟹王,5,"Excellent services, celebrating mum's birthday here. Staffs here are all very friendly and helpful, from ordering to serving to cake cutting, they even sing the bday song together with us👍.. Food here are great, craypot crab with vermicelli is the best especially the soup, chilli crab came with bit of spiciness best to eat with their mantou, 冰镇咕噜肉 surprises us as its really crispy with slight cool on the outside but hot when u bite onto it, their truffles salad is one of their signature, great presentation with dry ice effect. Their 富贵鸡 is also a must try, full of ingredients like sea cucumbers, sea asparagus, scallops, fish maws and slices of Abalone, the chicken is really tender and flavourful, goes really well with juz white rice alone. Overall we really had a great dinner and celebration here.. Highly recommended 👍👍👍",2023-11-26T12:49:34.933Z,3,Polly Lim,4.0,False,2023-11-30T06:45:06.294Z,,3 months ago,,Dinner,Plenty of parking,$80–90,Dine in,5.0,5.0,5.0,ChdDSUhNMG9nS0VJQ0FnSUNsMF8zYXJRRRAB,https://lh5.googleusercontent.com/p/AF1QipPkENAYFLYpsl7kRw54dkLpRNmgBWBmY2n3Xs_p=w150-h150-k-no-p,https://lh5.googleusercontent.com/p/AF1QipMgJQjsKZfStq6pDyEh3ocQOXlmm-K5V59MkjNZ=w150-h150-k-no-p,https://lh5.googleusercontent.com/p/AF1QipO3nV-C3SWCe5q_d6WMzKLS6oKxjEt09LjBptSh=w150-h150-k-no-p,https://lh5.googleusercontent.com/p/AF1QipMolapxmI_TIzVc5eGVQsgFsb3VFDXJtuO_lY8C=w150-h150-k-no-p,https://lh5.googleusercontent.com/p/AF1QipPZe-oc5Tm5KJEqq8F5U-fy1tm6EwZ__jtyz_eE=w150-h150-k-no-p,https://lh5.googleusercontent.com/p/AF1QipPPn8rGqbyhALxHO-wpgpbHrjEiVCmEPymueNbA=w150-h150-k-no-p,https://lh5.googleusercontent.com/p/AF1QipNiFCQHBoM4Q3YLXAog_tx-kviA4pOnwgglBlB8=w150-h150-k-no-p,https://lh5.googleusercontent.com/p/AF1QipOgq73zwrprI0TFES976mx0ZYNjhqca0P5fNF3G=w150-h150-k-no-p,https://lh5.googleusercontent.com/p/AF1QipP8wauvZb5mSQa6QAfb9ZD1lpQ9jJcB6ZArPWq7=w150-h150-k-no-p,https://lh5.googleusercontent.com/p/AF1QipO5gPcudVaAKDORLPL-QfJrBWp05HIhU4MfesVE=w150-h150-k-no-p,https://lh5.googleusercontent.com/p/AF1QipPqtpWEUwz5uDhFpRHgF0NqQuEt0NzP5zT0Rih_=w150-h150-k-no-p,,,,,,,,,,,,,,,,,,,,,,,,,Google,https://www.google.com/maps/reviews/data=!4m8!14m7!1m6!2m5!1sChdDSUhNMG9nS0VJQ0FnSUNsMF8zYXJRRRAB!2m1!1s0x0:0x9b90359aa86f9f5e!3m1!1s2@1:CIHM0ogKEICAgICl0_3arQE%7CCgwI3v2MqwYQqPmXvQM%7C?hl=en,102499125546841434568,https://lh3.googleusercontent.com/a/ACg8ocKJcrpZmQDpVdKzfI8K07fM1jXh5wkRN6WiF1dAPV3x=s120-c-rp-mo-br100,https://www.google.com/maps/contrib/102499125546841434568?hl=en,,,,,,,,,,,,,,,,,,en,141
8062,Al Barakath Restaurant,3,"Prices inexpensive, serving Indian Muslim Food,  No alcohol served. Foods: uttapam, dosai, masala, bryani, prata, nasI goreng,",2023-06-14T05:16:36.295Z,0,Chong Jackson,285.0,False,,,8 months ago,,Dinner,Plenty of parking,$10–20,Dine in,3.0,3.0,3.0,ChZDSUhNMG9nS0VJQ0FnSUNZbmZLWFRREAE,,,,,,,,,,,,,,,,,,,,,,,,,,,,,,,,,,,,Google,https://www.google.com/maps/reviews/data=!4m8!14m7!1m6!2m5!1sChZDSUhNMG9nS0VJQ0FnSUNZbmZLWFRREAE!2m1!1s0x0:0x36e7ea2c3ff66088!3m1!1s2@1:CIHM0ogKEICAgICYnfKXTQ%7CCgwItJqlpAYQkPHujAE%7C?hl=en,110485838762924027222,https://lh3.googleusercontent.com/a-/ALV-UjV1qpOEHZL2Q6AgZJWURY5cpt7HTctCh7qPL9PEWqog_w=s120-c-rp-mo-ba5-br100,https://www.google.com/maps/contrib/110485838762924027222?hl=en,,,,,,,,,,,,,,,,,,en,17
7213,Jubilee Garden Restaurant,4,I found the information regarding what they actually offer lacking online so I talked to a friendly male staff about it. They mainly do buffet and wedding packages but they also actually offer ala carte menu as well. This review is more for posting their ala carte menu photos for the benefit of everyone. I will go back for the food someday.,2022-07-02T14:35:26.318Z,1,Kevin Lee,22.0,True,,,a year ago,,,,,,,,,ChdDSUhNMG9nS0VJQ0FnSURPcXRqNHJnRRAB,https://lh5.googleusercontent.com/p/AF1QipO_ueTKkL2gCsxCYy2TseIHIk8eLFZZ-WNOpYns=w150-h150-k-no-p,https://lh5.googleusercontent.com/p/AF1QipOc9yH85HEiozNryOPj0ZEofDW961zsnwUKFtb6=w150-h150-k-no-p,https://lh5.googleusercontent.com/p/AF1QipO_7-Dc0go0HBIyrnOLhrjZbmH_xIut6clW2G11=w150-h150-k-no-p,https://lh5.googleusercontent.com/p/AF1QipNCAI6_fJoToNPHzqcrt0gVZtQ2bBCKI9K669Yl=w150-h150-k-no-p,https://lh5.googleusercontent.com/p/AF1QipOM6_o3Gf5TDOLUXPNgKTQOB-rIKk0BuD4UNQFl=w150-h150-k-no-p,https://lh5.googleusercontent.com/p/AF1QipN0X1QaTWS040pWMfHXExmTG7xKF4OktyJzKkfO=w150-h150-k-no-p,,,,,,,,,,,,,,,,,,,,,,,,,,,,,,Google,https://www.google.com/maps/reviews/data=!4m8!14m7!1m6!2m5!1sChdDSUhNMG9nS0VJQ0FnSURPcXRqNHJnRRAB!2m1!1s0x0:0x41afa224dc74e791!3m1!1s2@1:CIHM0ogKEICAgIDOqtj4rgE%7CCgwIrq-BlgYQwNXRlwE%7C?hl=en,111201376000045597624,https://lh3.googleusercontent.com/a-/ALV-UjUoPvGaX4OJZX3MEe2Sv_LuVQp0yvxn0AOTP2bxXZ6hS3U=s120-c-rp-mo-ba3-br100,https://www.google.com/maps/contrib/111201376000045597624?hl=en,,,,,,,,,,,,,,,,,,en,62
